{
  "$schema": ".\\schemas\\umm-info.schema.json",
  "Id": "Griz1231.Ocanaluftee_River.RAIL",
  "DisplayName": "Ocanoluftee River (RAIL)",
  "Author": "Griz1231",
  "Version": "0.5.0",
  "ManagerVersion": "0.27.10",
  "Requirements": [
    "RAIL"
  ],
  "LoadAfter": [
    "RAIL"
  ],
  "RailDataFiles": [
    "game-graph.rail.json",
    "buildings.rail.json",
    "progressions.rail.json"
  ]
}